<?xml version = "1.0" encoding = "ISO-8859-1" ?>

<form xmlns              = "http://cl/bee/genfrmjava/formdef/schema"
      xmlns:xsi          = "http://www.w3.org/2001/XMLSchema-instance"
      xsi:schemaLocation = "http://cl/bee/genfrmjava/formdef/schema formdef.xsd"
      entity             = "SGC_QCM"
      name               = "QCM"
      posx               = "3"
      posy               = "21"
      width              = "80">

  <field name="RCE-COD-ENTI">
    <type name="string" size="3"/>
    <fms name="RCE_IKY_COD_ENTI" modifier="IKY" row="4" column="19" picture="XXX" attributes="2291189"/>
  </field>

  <field name="FRM-GLS-ENTI">
    <type name="string" size="40"/>
    <fms name="FRM_IKY_GLS_ENTI" modifier="IKY" row="4" column="25" picture="XXXXXXXXXXXXXXXXXXXXXXXXXXXXXXXXXXXXXXXX" attributes="2161911"/>
  </field>

  <field name="FRM-GLS-TNOM">
    <type name="string" size="12"/>
    <fms name="FRM_IKY_GLS_TNOM" modifier="IKY" row="5" column="4" picture="XXXXXXXXXXXX" attributes="64759"/>
  </field>

  <field name="DBC-GLS-NOMC">
    <type name="string" size="60"/>
    <fms name="DBC_AKY_GLS_NOMC" modifier="AKY" row="5" column="19" picture="XXXXXXXXXXXXXXXXXXXXXXXXXXXXXXXXXXXXXXXXXXXXXXXXXXXXXXXXXXXX" attributes="194037"/>
  </field>

  <field name="FRM-GLS-TIDC">
    <type name="string" size="12"/>
    <fms name="FRM_IKY_GLS_TIDC" modifier="IKY" row="6" column="4" picture="XXXXXXXXXXXX" attributes="64759"/>
  </field>

  <field name="DBC-VRF-ICLI" special="VRF">
    <type name="string" size="10"/>
    <fms name="DBC_IKY_VRF_ICLI" modifier="IKY" row="6" column="19" picture="XXXXXXXX-X" attributes="2553317"/>
  </field>

  <field name="DBC-IDC-ICLI" special="IDC">
    <type name="string" size="5"/>
    <fms name="DBC_IKY_IDC_ICLI" modifier="IKY" row="6" column="36" picture="X-XXX" attributes="194037"/>
  </field>

  <field name="FRM-GLS-TOPE">
    <type name="string" size="12"/>
    <fms name="FRM_IKY_GLS_TOPE" modifier="IKY" row="6" column="46" picture="XXXXXXXXXXXX" attributes="64759"/>
  </field>

  <field name="FRM-CAI-IOPE">
    <type name="string" size="4"/>
    <fms name="FRM_IKY_CAI_IOPE" modifier="IKY" row="6" column="61" picture="XXXX" attributes="194037"/>
  </field>

  <field name="FRM-IIC-IOPE">
    <type name="string" size="8"/>
    <fms name="FRM_IKY_IIC_IOPE" modifier="IKY" row="6" column="71" picture="XXXXXXXX" attributes="65013"/>
  </field>

  <field name="FRM-GLS-TFEC">
    <type name="string" size="12"/>
    <fms name="FRM_IKY_GLS_TFEC" modifier="IKY" row="7" column="4" picture="XXXXXXXXXXXX" attributes="64759"/>
  </field>

  <field name="FRM-FEC-FENT" special="FEC">
    <type name="date" size="10"/>
    <fms name="FRM_IKY_FEC_FENT" modifier="IKY" row="7" column="19" picture="99-99-9999" attributes="194037"/>
  </field>

  <field name="FRM-GLS-TNRO">
    <type name="string" size="5"/>
    <fms name="FRM_IKY_GLS_TNRO" modifier="IKY" row="7" column="32" picture="XXXXX" attributes="64759"/>
  </field>

  <field name="FRM-NUM-IENT">
    <type name="integer" size="3" integers="3"/>
    <fms name="FRM_IKY_NUM_IENT" modifier="IKY" row="7" column="40" picture="999" attributes="2020836"/>
  </field>

  <field name="FRM-GLS-TCOD">
    <type name="string" size="12"/>
    <fms name="FRM_IKY_GLS_TCOD" modifier="IKY" row="7" column="46" picture="XXXXXXXXXXXX" attributes="64759"/>
  </field>

  <field name="FRM-COD-IENT">
    <type name="string" size="3"/>
    <fms name="FRM_IKY_COD_IENT" modifier="IKY" row="7" column="61" picture="XXX" attributes="194037"/>
  </field>

  <field name="FRM-GLS-IENT">
    <type name="string" size="12"/>
    <fms name="FRM_GLS_IENT" modifier="FLD" row="7" column="67" picture="XXXXXXXXXXXX" attributes="193783"/>
  </field>

  <array size="5">

    <field name="FRM-COD-ENTI">
      <type name="string" size="3"/>
      <fms name="FRM_COD_ENTI" modifier="FLD" picture="XXX" attributes="64759"/>
      <index>
        <pos row="12" column="4"/>
        <pos row="14" column="4"/>
        <pos row="16" column="4"/>
        <pos row="18" column="4"/>
        <pos row="20" column="4"/>
      </index>
    </field>

    <field name="FRM-NUM-GCMT">
      <type name="integer" size="1" integers="1"/>
      <fms name="FRM_NUM_GCMT" modifier="FLD" picture="9" attributes="193783"/>
      <index>
        <pos row="12" column="14"/>
        <pos row="14" column="14"/>
        <pos row="16" column="14"/>
        <pos row="18" column="14"/>
        <pos row="20" column="14"/>
      </index>
    </field>

    <field name="FRM-CIC-IENT">
      <type name="string" size="12"/>
      <fms name="FRM_CIC_IENT" modifier="FLD" picture="XXXXXXXXXXXX" attributes="193783"/>
      <index>
        <pos row="12" column="17"/>
        <pos row="14" column="17"/>
        <pos row="16" column="17"/>
        <pos row="18" column="17"/>
        <pos row="20" column="17"/>
      </index>
    </field>

    <field name="FRM-FEC-FCMT" special="FEC">
      <type name="date" size="10"/>
      <fms name="FRM_FEC_FCMT" modifier="FLD" picture="99-99-9999" attributes="193783"/>
      <index>
        <pos row="12" column="30"/>
        <pos row="14" column="30"/>
        <pos row="16" column="30"/>
        <pos row="18" column="30"/>
        <pos row="20" column="30"/>
      </index>
    </field>

    <field name="FRM-COD-AUTC">
      <type name="string" size="12"/>
      <fms name="FRM_COD_AUTC" modifier="FLD" picture="XXXXXXXXXXXX" attributes="4242679"/>
      <index>
        <pos row="12" column="41"/>
        <pos row="14" column="41"/>
        <pos row="16" column="41"/>
        <pos row="18" column="41"/>
        <pos row="20" column="41"/>
      </index>
    </field>

    <field name="FRM-GLS-IENX">
      <type name="string" size="26"/>
      <fms name="FRM_GLS_IENX" modifier="FLD" picture="XXXXXXXXXXXXXXXXXXXXXXXXXX" attributes="64759"/>
      <index>
        <pos row="12" column="54"/>
        <pos row="14" column="54"/>
        <pos row="16" column="54"/>
        <pos row="18" column="54"/>
        <pos row="20" column="54"/>
      </index>
    </field>

    <field name="FRM-COD-SIST">
      <type name="string" size="3"/>
      <fms name="FRM_COD_SIST" modifier="FLD" picture="XXX" attributes="64759"/>
      <index>
        <pos row="13" column="6"/>
        <pos row="15" column="6"/>
        <pos row="17" column="6"/>
        <pos row="19" column="6"/>
        <pos row="21" column="6"/>
      </index>
    </field>

    <field name="FRM-GLS-REFE">
      <type name="string" size="60"/>
      <fms name="FRM_GLS_REFE" modifier="FLD" picture="XXXXXXXXXXXXXXXXXXXXXXXXXXXXXXXXXXXXXXXXXXXXXXXXXXXXXXXXXXXX" attributes="4242679"/>
      <index>
        <pos row="13" column="16"/>
        <pos row="15" column="16"/>
        <pos row="17" column="16"/>
        <pos row="19" column="16"/>
        <pos row="21" column="16"/>
      </index>
    </field>

  </array>

  <primary>
    <field name="RCE-COD-ENTI"/>
    <field name="FRM-GLS-ENTI"/>
    <field name="FRM-GLS-TNOM"/>
    <field name="FRM-GLS-TIDC"/>
    <field name="DBC-VRF-ICLI"/>
    <field name="DBC-IDC-ICLI"/>
    <field name="FRM-GLS-TOPE"/>
    <field name="FRM-CAI-IOPE"/>
    <field name="FRM-IIC-IOPE"/>
    <field name="FRM-GLS-TFEC"/>
    <field name="FRM-FEC-FENT"/>
    <field name="FRM-GLS-TNRO"/>
    <field name="FRM-NUM-IENT"/>
    <field name="FRM-GLS-TCOD"/>
    <field name="FRM-COD-IENT"/>
  </primary>

  <foreign entity="{{{TODO_foreign_entity}}}">
    <field name="DBC-GLS-NOMC"/>
  </foreign>

  <text caption="Tipo Coment" row="4" column="4" />
  <text caption="Tip.Cmt Nro.Cmt Ident.Cmt  Fecha.Cmt  Autor.Cmt   Identif. Entidad" row="9" column="4" />
  <text caption="Cod.Sist    Referencia" row="10" column="6" />
  <text caption="----------------------------------------------------------------------------" row="11" column="4" />

</form>
