<?xml version = "1.0" encoding = "ISO-8859-1" ?>

<form xmlns              = "http://cl/bee/genfrmjava/formdef/schema"
      xmlns:xsi          = "http://www.w3.org/2001/XMLSchema-instance"
      xsi:schemaLocation = "http://cl/bee/genfrmjava/formdef/schema formdef.xsd"
      entity             = "SGC_CAC"
      name               = "CAC"
      posx               = "1"
      posy               = "23"
      width              = "80">

  <field name="CAC-COD-CPTO">
    <type name="string" size="12"/>
    <fms name="CAC_IKY_COD_CPTO" modifier="IKY" row="4" column="15" picture="XXXXXXXXXXXX" attributes="259573"/>
  </field>

  <field name="FRM-GLS-CPTO">
    <type name="string" size="41"/>
    <fms name="FRM_GLS_CPTO" modifier="FLD" row="4" column="30" picture="XXXXXXXXXXXXXXXXXXXXXXXXXXXXXXXXXXXXXXXXX" attributes="64759"/>
  </field>

  <field name="DBC-VRF-ICLI" special="VRF">
    <type name="string" size="10"/>
    <fms name="DBC_IKY_VRF_ICLI" modifier="IKY" row="5" column="15" picture="XXXXXXXX-X" attributes="259573"/>
  </field>

  <field name="DBC-IDC-ICLI" special="IDC">
    <type name="string" size="5"/>
    <fms name="DBC_IKY_IDC_ICLI" modifier="IKY" row="5" column="32" picture="X-XXX" attributes="194037"/>
  </field>

  <field name="CAC-FEC-FINI" special="FEC">
    <type name="date" size="8" integers="8"/>
    <fms name="CAC_IKY_FEC_FINI" modifier="IKY" row="5" column="51" picture="99999999" attributes="194037"/>
  </field>

  <field name="CAC-HRA-HINI">
    <type name="integer" size="6" integers="6"/>
    <fms name="CAC_IKY_HRA_HINI" modifier="IKY" row="5" column="72" picture="999999" attributes="194037"/>
  </field>

  <field name="CAC-IND-VIGE">
    <type name="char" size="1"/>
    <fms name="CAC_IND_VIGE" modifier="FLD" row="7" column="17" picture="X" attributes="65013"/>
  </field>

  <field name="CAC-FEC-FTER" special="FEC">
    <type name="date" size="8" integers="8"/>
    <fms name="CAC_FEC_FTER" modifier="FLD" row="7" column="51" picture="99999999" attributes="65013"/>
  </field>

  <field name="CAC-HRA-HTER">
    <type name="integer" size="6" integers="6"/>
    <fms name="CAC_HRA_HTER" modifier="FLD" row="7" column="72" picture="999999" attributes="65013"/>
  </field>

  <field name="CAC-VAL-MNTO">
    <type name="double" size="19" integers="11" decimals="4" sign="no" />
    <fms name="CAC_VAL_MNTO" modifier="FLD" row="9" column="17" picture="99.999.999.999,9999" attributes="1628668"/>
  </field>

  <field name="CAC-COD-MONE">
    <type name="string" size="6"/>
    <fms name="CAC_COD_MONE" modifier="FLD" row="9" column="58" picture="XXXXXX" attributes="65013"/>
  </field>

  <field name="FRM-GLS-MONE">
    <type name="string" size="12"/>
    <fms name="FRM_GLS_MONE" modifier="FLD" row="9" column="67" picture="XXXXXXXXXXXX" attributes="64759"/>
  </field>

  <field name="CAC-VAL-PORC">
    <type name="double" size="8" integers="3" decimals="4" sign="no" />
    <fms name="CAC_VAL_PORC" modifier="FLD" row="10" column="28" picture="999,9999" attributes="1628668"/>
  </field>

  <field name="CAC-COD-COD1">
    <type name="string" size="12"/>
    <fms name="CAC_COD_COD1" modifier="FLD" row="12" column="17" picture="XXXXXXXXXXXX" attributes="65013"/>
  </field>

  <field name="CAC-COD-COD2">
    <type name="string" size="12"/>
    <fms name="CAC_COD_COD2" modifier="FLD" row="12" column="58" picture="XXXXXXXXXXXX" attributes="65013"/>
  </field>

  <field name="FRM-COD-CD12">
    <type name="string" size="24"/>
    <fms name="FRM_COD_CD12" modifier="FLD" row="13" column="17" picture="XXXXXXXXXXXXXXXXXXXXXXXX" attributes="65013"/>
  </field>

  <field name="CAC-COD-COD3">
    <type name="string" size="12"/>
    <fms name="CAC_COD_COD3" modifier="FLD" row="15" column="17" picture="XXXXXXXXXXXX" attributes="65013"/>
  </field>

  <field name="CAC-COD-COD4">
    <type name="string" size="12"/>
    <fms name="CAC_COD_COD4" modifier="FLD" row="15" column="58" picture="XXXXXXXXXXXX" attributes="65013"/>
  </field>

  <field name="FRM-COD-CD34">
    <type name="string" size="24"/>
    <fms name="FRM_COD_CD34" modifier="FLD" row="16" column="17" picture="XXXXXXXXXXXXXXXXXXXXXXXX" attributes="65013"/>
  </field>

  <field name="FRM-GLS-DES1">
    <type name="string" size="20"/>
    <fms name="FRM_GLS_DES1" modifier="FLD" row="18" column="17" picture="XXXXXXXXXXXXXXXXXXXX" attributes="65013"/>
  </field>

  <field name="FRM-GLS-DES2">
    <type name="string" size="20"/>
    <fms name="FRM_GLS_DES2" modifier="FLD" row="18" column="58" picture="XXXXXXXXXXXXXXXXXXXX" attributes="65013"/>
  </field>

  <field name="CAC-GLS-DESC">
    <type name="string" size="40"/>
    <fms name="CAC_GLS_DESC" modifier="FLD" row="19" column="17" picture="XXXXXXXXXXXXXXXXXXXXXXXXXXXXXXXXXXXXXXXX" attributes="65013"/>
  </field>

  <primary>
    <field name="CAC-COD-CPTO"/>
    <field name="DBC-VRF-ICLI"/>
    <field name="DBC-IDC-ICLI"/>
    <field name="CAC-FEC-FINI"/>
    <field name="CAC-HRA-HINI"/>
  </primary>

  <text caption="Concepto:" row="4" column="3" />
  <text caption="IdC     :" row="5" column="3" />
  <text caption="Fecha:" row="5" column="42" />
  <text caption="Hora:" row="5" column="64" />
  <text caption="----------------------------------------------------------------------------" row="6" column="3" />
  <text caption="Vigencia" row="7" column="3" />
  <text caption="Fecha Termino" row="7" column="35" />
  <text caption="Hora" row="7" column="64" />
  <text caption="Monto" row="9" column="3" />
  <text caption="Moneda" row="9" column="45" />
  <text caption="Porcentaje" row="10" column="3" />
  <text caption="Codigo.1" row="12" column="3" />
  <text caption="Codigo.2" row="12" column="45" />
  <text caption="Codigo.1+2" row="13" column="3" />
  <text caption="Codigo.3" row="15" column="3" />
  <text caption="Codigo.4" row="15" column="45" />
  <text caption="Codigo.3+4" row="16" column="3" />
  <text caption="Sub.Desc.1" row="18" column="3" />
  <text caption="Sub.Desc.2" row="18" column="45" />
  <text caption="Descripcion" row="19" column="3" />

</form>
