<?xml version = "1.0" encoding = "ISO-8859-1" ?>

<form xmlns              = "http://cl/bee/genfrmjava/formdef/schema"
      xmlns:xsi          = "http://www.w3.org/2001/XMLSchema-instance"
      xsi:schemaLocation = "http://cl/bee/genfrmjava/formdef/schema formdef.xsd"
      entity             = "TAB_OFI">

  <field name="OFI-COD-OFIC">
    <type name="string" size="3"/>
    <fms name="OFI_IKY_COD_OFIC" modifier="IKY" row="3" column="18" picture="XXX" attributes="2356725"/>
  </field>

  <field name="OFI-CIC-OFIC">
    <type name="string" size="3"/>
    <fms name="OFI_CIC_OFIC" modifier="FLD" row="3" column="53" picture="XXX" attributes="4242933"/>
  </field>

  <field name="OFI-EXT-CTAB">
    <type name="string" size="5"/>
    <fms name="OFI_EXT_CTAB" modifier="FLD" row="3" column="74" picture="XXXXX" attributes="4242933"/>
  </field>

  <field name="OFI-GLS-DESC">
    <type name="string" size="38"/>
    <fms name="OFI_GLS_DESC" modifier="FLD" row="5" column="18" picture="XXXXXXXXXXXXXXXXXXXXXXXXXXXXXXXXXXXXXX" attributes="4308469"/>
  </field>

  <field name="OFI-GLS-ABRV">
    <type name="string" size="5"/>
    <fms name="OFI_GLS_ABRV" modifier="FLD" row="5" column="74" picture="XXXXX" attributes="4308469"/>
  </field>

  <field name="OFI-GLS-DIRE">
    <type name="string" size="38"/>
    <fms name="OFI_GLS_DIRE" modifier="FLD" row="7" column="18" picture="XXXXXXXXXXXXXXXXXXXXXXXXXXXXXXXXXXXXXX" attributes="4308469"/>
  </field>

  <field name="OFI-COD-COMU">
    <type name="string" size="4"/>
    <fms name="OFI_COD_COMU" modifier="FLD" row="7" column="75" picture="XXXX" attributes="4242933"/>
  </field>

  <field name="FRM-GLS-COMU">
    <type name="string" size="16"/>
    <fms name="FRM_GLS_COMU" modifier="FLD" row="8" column="63" picture="XXXXXXXXXXXXXXXX" attributes="2161911"/>
  </field>

  <field name="OFI-GLS-TLEX">
    <type name="string" size="38"/>
    <fms name="OFI_GLS_TLEX" modifier="FLD" row="9" column="18" picture="XXXXXXXXXXXXXXXXXXXXXXXXXXXXXXXXXXXXXX" attributes="4242933"/>
  </field>

  <field name="OFI-COD-PLZA">
    <type name="string" size="4"/>
    <fms name="OFI_COD_PLZA" modifier="FLD" row="9" column="75" picture="XXXX" attributes="4242933"/>
  </field>

  <field name="FRM-GLS-PLZA">
    <type name="string" size="16"/>
    <fms name="FRM_GLS_PLZA" modifier="FLD" row="10" column="63" picture="XXXXXXXXXXXXXXXX" attributes="2161911"/>
  </field>

  <field name="OFI-GLS-FON1">
    <type name="string" size="10"/>
    <fms name="OFI_GLS_FON1" modifier="FLD" row="11" column="18" picture="XXXXXXXXXX" attributes="4242933"/>
  </field>

  <field name="OFI-GLS-FON2">
    <type name="string" size="10"/>
    <fms name="OFI_GLS_FON2" modifier="FLD" row="11" column="33" picture="XXXXXXXXXX" attributes="4505061"/>
  </field>

  <field name="OFI-GLS-ANX1">
    <type name="string" size="4"/>
    <fms name="OFI_GLS_ANX1" modifier="FLD" row="11" column="63" picture="XXXX" attributes="4242933"/>
  </field>

  <field name="OFI-GLS-ANX2">
    <type name="string" size="4"/>
    <fms name="OFI_GLS_ANX2" modifier="FLD" row="11" column="75" picture="XXXX" attributes="4242933"/>
  </field>

  <field name="OFI-VRF-CCTE" special="VRF">
    <type name="string" size="14"/>
    <fms name="OFI_VRF_CCTE" modifier="FLD" row="13" column="18" picture="XXXXXXXXXXXX-X" attributes="4505061"/>
  </field>

  <field name="OFI-VRF-CCON" special="VRF">
    <type name="string" size="14"/>
    <fms name="OFI_VRF_CCON" modifier="FLD" row="13" column="63" picture="XXXXXXXXXXXX-X" attributes="4505061"/>
  </field>

  <field name="OFI-COD-OREG">
    <type name="string" size="3"/>
    <fms name="OFI_COD_OREG" modifier="FLD" row="15" column="18" picture="XXX" attributes="4242933"/>
  </field>

  <field name="FRM-GLS-OREG">
    <type name="string" size="17"/>
    <fms name="FRM_GLS_OREG" modifier="FLD" row="15" column="26" picture="XXXXXXXXXXXXXXXXX" attributes="2161911"/>
  </field>

  <field name="OFI-COD-OFCO">
    <type name="string" size="3"/>
    <fms name="OFI_COD_OFCO" modifier="FLD" row="15" column="76" picture="XXX" attributes="4242933"/>
  </field>

  <field name="FRM-GLS-GREG">
    <type name="string" size="37"/>
    <fms name="FRM_GLS_GREG" modifier="FLD" row="16" column="6" picture="XXXXXXXXXXXXXXXXXXXXXXXXXXXXXXXXXXXXX" attributes="2161911"/>
  </field>

  <field name="FRM-GLS-OFCO">
    <type name="string" size="29"/>
    <fms name="FRM_GLS_OFCO" modifier="FLD" row="16" column="50" picture="XXXXXXXXXXXXXXXXXXXXXXXXXXXXX" attributes="2161911"/>
  </field>

  <field name="OFI-COD-JFOF">
    <type name="string" size="12"/>
    <fms name="OFI_COD_JFOF" modifier="FLD" row="17" column="18" picture="XXXXXXXXXXXX" attributes="4242933"/>
  </field>

  <field name="OFI-FEC-FJFO" special="FEC">
    <type name="date" size="10"/>
    <fms name="OFI_FEC_FJFO" modifier="FLD" row="17" column="46" picture="99-99-9999" attributes="4242933"/>
  </field>

  <field name="OFI-IND-CCOM">
    <type name="char" size="1"/>
    <fms name="OFI_IND_CCOM" modifier="FLD" row="17" column="78" picture="X" attributes="4242933"/>
  </field>

  <field name="FRM-GLS-JFOF">
    <type name="string" size="37"/>
    <fms name="FRM_GLS_JFOF" modifier="FLD" row="18" column="6" picture="XXXXXXXXXXXXXXXXXXXXXXXXXXXXXXXXXXXXX" attributes="2161911"/>
  </field>

  <field name="FRM-GLS-CCOM">
    <type name="string" size="16"/>
    <fms name="FRM_GLS_CCOM" modifier="FLD" row="18" column="63" picture="XXXXXXXXXXXXXXXX" attributes="2161911"/>
  </field>

  <field name="OFI-COD-JOOF">
    <type name="string" size="12"/>
    <fms name="OFI_COD_JOOF" modifier="FLD" row="19" column="18" picture="XXXXXXXXXXXX" attributes="4242933"/>
  </field>

  <field name="OFI-FEC-FJOO" special="FEC">
    <type name="date" size="10"/>
    <fms name="OFI_FEC_FJOO" modifier="FLD" row="19" column="46" picture="99-99-9999" attributes="4242933"/>
  </field>

  <field name="OFI-IND-COPE">
    <type name="char" size="1"/>
    <fms name="OFI_IND_COPE" modifier="FLD" row="19" column="78" picture="X" attributes="4242933"/>
  </field>

  <field name="FRM-GLS-JOOF">
    <type name="string" size="37"/>
    <fms name="FRM_GLS_JOOF" modifier="FLD" row="20" column="6" picture="XXXXXXXXXXXXXXXXXXXXXXXXXXXXXXXXXXXXX" attributes="2161911"/>
  </field>

  <field name="FRM-GLS-COPE">
    <type name="string" size="16"/>
    <fms name="FRM_GLS_COPE" modifier="FLD" row="20" column="63" picture="XXXXXXXXXXXXXXXX" attributes="2161911"/>
  </field>

  <field name="OFI-FEC-FAPE" special="FEC">
    <type name="date" size="10"/>
    <fms name="OFI_FEC_FAPE" modifier="FLD" row="21" column="18" picture="99-99-9999" attributes="4242933"/>
  </field>

  <field name="OFI-FEC-FCIE" special="FEC">
    <type name="date" size="10"/>
    <fms name="OFI_FEC_FCIE" modifier="FLD" row="21" column="46" picture="99-99-9999" attributes="4242933"/>
  </field>

  <field name="OFI-FEC-FTRN" special="FEC">
    <type name="date" size="10"/>
    <fms name="OFI_FEC_FTRN" modifier="FLD" row="21" column="69" picture="99-99-9999" attributes="4242679"/>
  </field>

  <primary>
    <field name="OFI-COD-OFIC"/>
  </primary>

  <text caption="01. Cod Ofic" row="3" column="2" />
  <text caption="02. Cod Int Comp" row="3" column="33" />
  <text caption="03. Cod Ext" row="3" column="59" />
  <text caption="04. Oficina" row="5" column="2" />
  <text caption="05. Abreviac" row="5" column="59" />
  <text caption="06. Direccion" row="7" column="2" />
  <text caption="07. Comuna" row="7" column="59" />
  <text caption="08. Telex" row="9" column="2" />
  <text caption="09. Plaza" row="9" column="59" />
  <text caption="10. Fonos" row="11" column="2" />
  <text caption="11. Anexos" row="11" column="46" />
  <text caption="12. Cta Cte" row="13" column="2" />
  <text caption="13. Cta Ctble" row="13" column="46" />
  <text caption="14. Regional" row="15" column="2" />
  <text caption="15. Ofic Central Operativa" row="15" column="46" />
  <text caption="16. Jefe Ofic" row="17" column="2" />
  <text caption="17. Desde" row="17" column="33" />
  <text caption="18. Clasif Comer" row="17" column="59" />
  <text caption="19. Jefe Oper" row="19" column="2" />
  <text caption="20. Desde" row="19" column="33" />
  <text caption="21. Clasif Oper" row="19" column="59" />
  <text caption="22. Apertura" row="21" column="2" />
  <text caption="23. Cierre" row="21" column="33" />
  <text caption="24. Mod" row="21" column="59" />

</form>
