<?xml version = "1.0" encoding = "ISO-8859-1" ?>

<form xmlns              = "http://cl/bee/genfrmjava/formdef/schema"
      xmlns:xsi          = "http://www.w3.org/2001/XMLSchema-instance"
      xsi:schemaLocation = "http://cl/bee/genfrmjava/formdef/schema formdef.xsd"
      entity             = "SGC_DDJ"
      name               = "DDJ"
      posx               = "1"
      posy               = "23"
      width              = "80">

  <field name="FRM-CAI-IFOL">
    <type name="string" size="4"/>
    <fms name="FRM_IKY_CAI_IFOL" modifier="IKY" row="4" column="26" picture="XXXX" attributes="130549"/>
  </field>

  <field name="FRM-IIC-IFOL">
    <type name="string" size="8"/>
    <fms name="FRM_IKY_IIC_IFOL" modifier="IKY" row="4" column="35" picture="XXXXXXXX" attributes="130549"/>
  </field>

  <field name="DBC-VRF-ICLI" special="VRF">
    <type name="string" size="10"/>
    <fms name="DBC_VRF_ICLI" modifier="FLD" row="6" column="26" picture="XXXXXXXX-X" attributes="64759"/>
  </field>

  <field name="DBC-IDC-ICLI" special="IDC">
    <type name="string" size="5"/>
    <fms name="DBC_IDC_ICLI" modifier="FLD" row="6" column="42" picture="X-XXX" attributes="64759"/>
  </field>

  <field name="DBC-GLS-NOMC">
    <type name="string" size="60"/>
    <fms name="DBC_GLS_NOMC" modifier="FLD" row="9" column="15" picture="XXXXXXXXXXXXXXXXXXXXXXXXXXXXXXXXXXXXXXXXXXXXXXXXXXXXXXXXXXXX" attributes="64759"/>
  </field>

  <field name="FRM-EST-DDJ">
    <type name="char" size="1"/>
    <fms name="FRM_EST_DDJ" modifier="FLD" row="11" column="26" picture="X" attributes="64759"/>
  </field>

  <field name="FRM-GLS-DDJ">
    <type name="string" size="46"/>
    <fms name="FRM_GLS_DDJ" modifier="FLD" row="11" column="29" picture="XXXXXXXXXXXXXXXXXXXXXXXXXXXXXXXXXXXXXXXXXXXXXX" attributes="64759"/>
  </field>

  <field name="FRM-CAI-IFOA">
    <type name="string" size="4"/>
    <fms name="FRM_CAI_IFOA" modifier="FLD" row="13" column="26" picture="XXXX" attributes="64759"/>
  </field>

  <field name="FRM-IIC-IFOA">
    <type name="string" size="8"/>
    <fms name="FRM_IIC_IFOA" modifier="FLD" row="13" column="31" picture="XXXXXXXX" attributes="64759"/>
  </field>

  <primary>
    <field name="FRM-CAI-IFOL"/>
    <field name="FRM-IIC-IFOL"/>
  </primary>

  <text caption="Declaracion Jurada  :" row="4" column="2" />
  <text caption="IdC                 :" row="6" column="2" />
  <text caption="Nombre o" row="8" column="2" />
  <text caption="R Social :" row="9" column="2" />
  <text caption="Estado Decl.Jurada  :" row="11" column="2" />
  <text caption="Declaracion Anterior:" row="13" column="2" />

</form>
