<?xml version = "1.0" encoding = "ISO-8859-1" ?>

<form xmlns              = "http://cl/bee/genfrmjava/formdef/schema"
      xmlns:xsi          = "http://www.w3.org/2001/XMLSchema-instance"
      xsi:schemaLocation = "http://cl/bee/genfrmjava/formdef/schema formdef.xsd"
      entity             = "SGC_QC2"
      name               = "QC2"
      posx               = "3"
      posy               = "21"
      width              = "80">

  <field name="RCE-COD-SIST">
    <type name="string" size="3"/>
    <fms name="RCE_IKY_COD_SIST" modifier="IKY" row="3" column="13" picture="XXX" attributes="65013"/>
  </field>

  <field name="FRM-GLS-SIST">
    <type name="string" size="20"/>
    <fms name="FRM_GLS_SIST" modifier="FLD" row="3" column="19" picture="XXXXXXXXXXXXXXXXXXXX" attributes="64759"/>
  </field>

  <field name="RCE-COD-ENTI">
    <type name="string" size="3"/>
    <fms name="RCE_IKY_COD_ENTI" modifier="IKY" row="3" column="52" picture="XXX" attributes="2291189"/>
  </field>

  <field name="FRM-GLS-ENTI">
    <type name="string" size="20"/>
    <fms name="FRM_IKY_GLS_ENTI" modifier="IKY" row="3" column="58" picture="XXXXXXXXXXXXXXXXXXXX" attributes="2161911"/>
  </field>

  <field name="FRM-GLS-TNOM">
    <type name="string" size="12"/>
    <fms name="FRM_IKY_GLS_TNOM" modifier="IKY" row="4" column="3" picture="XXXXXXXXXXXX" attributes="64759"/>
  </field>

  <field name="DBC-GLS-NOMC">
    <type name="string" size="60"/>
    <fms name="DBC_AKY_GLS_NOMC" modifier="AKY" row="4" column="18" picture="XXXXXXXXXXXXXXXXXXXXXXXXXXXXXXXXXXXXXXXXXXXXXXXXXXXXXXXXXXXX" attributes="194037"/>
  </field>

  <field name="FRM-GLS-TIDC">
    <type name="string" size="12"/>
    <fms name="FRM_IKY_GLS_TIDC" modifier="IKY" row="5" column="3" picture="XXXXXXXXXXXX" attributes="64759"/>
  </field>

  <field name="DBC-VRF-ICLI" special="VRF">
    <type name="string" size="10"/>
    <fms name="DBC_IKY_VRF_ICLI" modifier="IKY" row="5" column="18" picture="XXXXXXXX-X" attributes="2553317"/>
  </field>

  <field name="DBC-IDC-ICLI" special="IDC">
    <type name="string" size="5"/>
    <fms name="DBC_IKY_IDC_ICLI" modifier="IKY" row="5" column="35" picture="X-XXX" attributes="194037"/>
  </field>

  <field name="FRM-GLS-TOPE">
    <type name="string" size="12"/>
    <fms name="FRM_IKY_GLS_TOPE" modifier="IKY" row="5" column="45" picture="XXXXXXXXXXXX" attributes="64759"/>
  </field>

  <field name="FRM-CAI-IOPE">
    <type name="string" size="4"/>
    <fms name="FRM_IKY_CAI_IOPE" modifier="IKY" row="5" column="60" picture="XXXX" attributes="194037"/>
  </field>

  <field name="FRM-IIC-IOPE">
    <type name="string" size="8"/>
    <fms name="FRM_IKY_IIC_IOPE" modifier="IKY" row="5" column="70" picture="XXXXXXXX" attributes="65013"/>
  </field>

  <field name="FRM-GLS-TFEC">
    <type name="string" size="12"/>
    <fms name="FRM_IKY_GLS_TFEC" modifier="IKY" row="6" column="3" picture="XXXXXXXXXXXX" attributes="64759"/>
  </field>

  <field name="FRM-FEC-FENT" special="FEC">
    <type name="date" size="10"/>
    <fms name="FRM_IKY_FEC_FENT" modifier="IKY" row="6" column="18" picture="99-99-9999" attributes="194037"/>
  </field>

  <field name="FRM-GLS-TNRO">
    <type name="string" size="5"/>
    <fms name="FRM_IKY_GLS_TNRO" modifier="IKY" row="6" column="31" picture="XXXXX" attributes="64759"/>
  </field>

  <field name="FRM-NUM-IENT">
    <type name="integer" size="3" integers="3"/>
    <fms name="FRM_IKY_NUM_IENT" modifier="IKY" row="6" column="39" picture="999" attributes="2020836"/>
  </field>

  <field name="FRM-GLS-TCOD">
    <type name="string" size="12"/>
    <fms name="FRM_IKY_GLS_TCOD" modifier="IKY" row="6" column="45" picture="XXXXXXXXXXXX" attributes="64759"/>
  </field>

  <field name="FRM-COD-IENT">
    <type name="string" size="3"/>
    <fms name="FRM_IKY_COD_IENT" modifier="IKY" row="6" column="60" picture="XXX" attributes="194037"/>
  </field>

  <field name="FRM-GLS-IENT">
    <type name="string" size="12"/>
    <fms name="FRM_GLS_IENT" modifier="FLD" row="6" column="66" picture="XXXXXXXXXXXX" attributes="193783"/>
  </field>

  <field name="FRM-COD-AUTD">
    <type name="string" size="12"/>
    <fms name="FRM_AKY_COD_AUTD" modifier="AKY" row="7" column="11" picture="XXXXXXXXXXXX" attributes="65013"/>
  </field>

  <field name="FRM-FEC-FDES" special="FEC">
    <type name="date" size="10"/>
    <fms name="FRM_AKY_FEC_FDES" modifier="AKY" row="7" column="43" picture="99-99-9999" attributes="65013"/>
  </field>

  <field name="FRM-FEC-FHAS" special="FEC">
    <type name="date" size="10"/>
    <fms name="FRM_AKY_FEC_FHAS" modifier="AKY" row="7" column="68" picture="99-99-9999" attributes="65013"/>
  </field>

  <field name="FRM-CAI-IENT">
    <type name="string" size="4"/>
    <fms name="FRM_AKY_CAI_IENT" modifier="AKY" row="8" column="18" picture="XXXX" attributes="194037"/>
  </field>

  <field name="FRM-IIC-IENT">
    <type name="string" size="8"/>
    <fms name="FRM_AKY_IIC_IENT" modifier="AKY" row="8" column="28" picture="XXXXXXXX" attributes="65013"/>
  </field>

  <array size="3">

    <field name="FRM-CIC-IENT">
      <type name="string" size="12"/>
      <fms name="FRM_CIC_IENT" modifier="FLD" picture="XXXXXXXXXXXX" attributes="193783"/>
      <index>
        <pos row="13" column="4"/>
        <pos row="16" column="4"/>
        <pos row="19" column="4"/>
      </index>
    </field>

    <field name="FRM-FEC-FCMT" special="FEC">
      <type name="date" size="10"/>
      <fms name="FRM_FEC_FCMT" modifier="FLD" picture="99-99-9999" attributes="193783"/>
      <index>
        <pos row="13" column="17"/>
        <pos row="16" column="17"/>
        <pos row="19" column="17"/>
      </index>
    </field>

    <field name="FRM-NUM-GCMT">
      <type name="integer" size="3" integers="3"/>
      <fms name="FRM_NUM_GCMT" modifier="FLD" picture="999" attributes="64759"/>
      <index>
        <pos row="13" column="30"/>
        <pos row="16" column="30"/>
        <pos row="19" column="30"/>
      </index>
    </field>

    <field name="FRM-NUM-CCMT">
      <type name="integer" size="3" integers="3"/>
      <fms name="FRM_NUM_CCMT" modifier="FLD" picture="999" attributes="64759"/>
      <index>
        <pos row="13" column="41"/>
        <pos row="16" column="41"/>
        <pos row="19" column="41"/>
      </index>
    </field>

    <field name="FRM-COD-AUTC">
      <type name="string" size="12"/>
      <fms name="FRM_COD_AUTC" modifier="FLD" picture="XXXXXXXXXXXX" attributes="4242679"/>
      <index>
        <pos row="13" column="48"/>
        <pos row="16" column="48"/>
        <pos row="19" column="48"/>
      </index>
    </field>

    <field name="FRM-COD-TCOM">
      <type name="string" size="12"/>
      <fms name="FRM_COD_TCOM" modifier="FLD" picture="XXXXXXXXXXXX" attributes="4242679"/>
      <index>
        <pos row="13" column="63"/>
        <pos row="16" column="63"/>
        <pos row="19" column="63"/>
      </index>
    </field>

    <field name="FRM-GLS-REFE">
      <type name="string" size="60"/>
      <fms name="FRM_GLS_REFE" modifier="FLD" picture="XXXXXXXXXXXXXXXXXXXXXXXXXXXXXXXXXXXXXXXXXXXXXXXXXXXXXXXXXXXX" attributes="4242679"/>
      <index>
        <pos row="14" column="7"/>
        <pos row="17" column="7"/>
        <pos row="20" column="7"/>
      </index>
    </field>

    <field name="FRM-GLS-KCM1">
      <type name="string" size="60"/>
      <fms name="FRM_GLS_KCM1" modifier="FLD" picture="XXXXXXXXXXXXXXXXXXXXXXXXXXXXXXXXXXXXXXXXXXXXXXXXXXXXXXXXXXXX" attributes="4242679"/>
      <index>
        <pos row="15" column="7"/>
        <pos row="18" column="7"/>
        <pos row="21" column="7"/>
      </index>
    </field>

  </array>

  <primary>
    <field name="RCE-COD-SIST"/>
    <field name="RCE-COD-ENTI"/>
    <field name="FRM-GLS-ENTI"/>
    <field name="FRM-GLS-TNOM"/>
    <field name="FRM-GLS-TIDC"/>
    <field name="DBC-VRF-ICLI"/>
    <field name="DBC-IDC-ICLI"/>
    <field name="FRM-GLS-TOPE"/>
    <field name="FRM-CAI-IOPE"/>
    <field name="FRM-IIC-IOPE"/>
    <field name="FRM-GLS-TFEC"/>
    <field name="FRM-FEC-FENT"/>
    <field name="FRM-GLS-TNRO"/>
    <field name="FRM-NUM-IENT"/>
    <field name="FRM-GLS-TCOD"/>
    <field name="FRM-COD-IENT"/>
  </primary>

  <foreign entity="{{{TODO_foreign_entity}}}">
    <field name="DBC-GLS-NOMC"/>
  </foreign>

  <foreign entity="{{{TODO_foreign_entity}}}">
    <field name="FRM-COD-AUTD"/>
  </foreign>

  <foreign entity="{{{TODO_foreign_entity}}}">
    <field name="FRM-FEC-FDES"/>
  </foreign>

  <foreign entity="{{{TODO_foreign_entity}}}">
    <field name="FRM-FEC-FHAS"/>
  </foreign>

  <foreign entity="{{{TODO_foreign_entity}}}">
    <field name="FRM-CAI-IENT"/>
  </foreign>

  <foreign entity="{{{TODO_foreign_entity}}}">
    <field name="FRM-IIC-IENT"/>
  </foreign>

  <text caption="Cod.Sist" row="3" column="3" />
  <text caption="Tip.Cmt" row="3" column="42" />
  <text caption="Autor" row="7" column="3" />
  <text caption="Fec.Desde" row="7" column="31" />
  <text caption="Fec.Hasta" row="7" column="56" />
  <text caption="Llave Cmt" row="8" column="3" />
  <text caption="Ident.Cmt   Fecha.Cmt  Grup.Cmt  Corr.Cmt   Autor.Cmt      Tip.Cmt" row="10" column="5" />
  <text caption="Referencia" row="11" column="7" />
  <text caption="Llave Cmt" row="12" column="7" />

</form>
