<?xml version = "1.0" encoding = "ISO-8859-1" ?>

<form xmlns              = "http://cl/bee/genfrmjava/formdef/schema"
      xmlns:xsi          = "http://www.w3.org/2001/XMLSchema-instance"
      xsi:schemaLocation = "http://cl/bee/genfrmjava/formdef/schema formdef.xsd"
      entity             = "SGC_CFC"
      name               = "CFC"
      posx               = "1"
      posy               = "23"
      width              = "80">

  <field name="DBC-VRF-ICLI" special="VRF">
    <type name="string" size="10"/>
    <fms name="DBC_IKY_VRF_ICLI" modifier="IKY" row="3" column="23" picture="XXXXXXXX-X" attributes="65013"/>
  </field>

  <field name="DBC-IDC-ICLI" special="IDC">
    <type name="string" size="5"/>
    <fms name="DBC_IKY_IDC_ICLI" modifier="IKY" row="3" column="40" picture="X-XXX" attributes="65013"/>
  </field>

  <field name="FRM-GLS-NOMC">
    <type name="string" size="33"/>
    <fms name="FRM_GLS_NOMC" modifier="FLD" row="4" column="23" picture="XXXXXXXXXXXXXXXXXXXXXXXXXXXXXXXXX" attributes="64759"/>
  </field>

  <field name="RPR-COD-TFRM">
    <type name="string" size="2"/>
    <fms name="RPR_IKY_COD_TFRM" modifier="IKY" row="5" column="23" picture="XX" attributes="65013"/>
  </field>

  <field name="FRM-GLS-LDOC">
    <type name="string" size="40"/>
    <fms name="FRM_GLS_LDOC" modifier="FLD" row="5" column="31" picture="XXXXXXXXXXXXXXXXXXXXXXXXXXXXXXXXXXXXXXXX" attributes="64759"/>
  </field>

  <field name="RPR-IND-ESTA">
    <type name="char" size="1"/>
    <fms name="RPR_IKY_IND_ESTA" modifier="IKY" row="6" column="23" picture="X" attributes="65013"/>
  </field>

  <field name="FRM-GLS-ESTA">
    <type name="string" size="15"/>
    <fms name="FRM_GLS_ESTA" modifier="FLD" row="6" column="31" picture="XXXXXXXXXXXXXXX" attributes="64759"/>
  </field>

  <field name="FRM-IND-HMAS">
    <type name="char" size="1"/>
    <fms name="FRM_MKY_IND_HMAS" modifier="MKY" row="7" column="5" picture="X" attributes="65013"/>
  </field>

  <field name="FRM-CAI-IFOR">
    <type name="string" size="4"/>
    <fms name="FRM_MKY_CAI_IFOR" modifier="MKY" row="7" column="12" picture="XXXX" attributes="65013"/>
  </field>

  <field name="FRM-IIC-IFOR">
    <type name="integer" size="8" integers="8"/>
    <fms name="FRM_MKY_IIC_IFOR" modifier="MKY" row="7" column="21" picture="99999999" attributes="1891812"/>
  </field>

  <array size="10">

    <field name="FRM-CAI-IFOL">
      <type name="string" size="4"/>
      <fms name="FRM_CAI_IFOL" modifier="FLD" picture="XXXX" attributes="64759"/>
      <index>
        <pos row="11" column="3"/>
        <pos row="12" column="3"/>
        <pos row="13" column="3"/>
        <pos row="14" column="3"/>
        <pos row="15" column="3"/>
        <pos row="16" column="3"/>
        <pos row="17" column="3"/>
        <pos row="18" column="3"/>
        <pos row="19" column="3"/>
        <pos row="20" column="3"/>
      </index>
    </field>

    <field name="FRM-IIC-IFOL">
      <type name="integer" size="8" integers="8"/>
      <fms name="FRM_IIC_IFOL" modifier="FLD" picture="99999999" attributes="1891558"/>
      <index>
        <pos row="11" column="8"/>
        <pos row="12" column="8"/>
        <pos row="13" column="8"/>
        <pos row="14" column="8"/>
        <pos row="15" column="8"/>
        <pos row="16" column="8"/>
        <pos row="17" column="8"/>
        <pos row="18" column="8"/>
        <pos row="19" column="8"/>
        <pos row="20" column="8"/>
      </index>
    </field>

    <field name="FRM-IND-ESTA">
      <type name="char" size="1"/>
      <fms name="FRM_IND_ESTA" modifier="FLD" picture="X" attributes="64759"/>
      <index>
        <pos row="11" column="20"/>
        <pos row="12" column="20"/>
        <pos row="13" column="20"/>
        <pos row="14" column="20"/>
        <pos row="15" column="20"/>
        <pos row="16" column="20"/>
        <pos row="17" column="20"/>
        <pos row="18" column="20"/>
        <pos row="19" column="20"/>
        <pos row="20" column="20"/>
      </index>
    </field>

    <field name="FRM-COD-TFRM">
      <type name="string" size="2"/>
      <fms name="FRM_COD_TFRM" modifier="FLD" picture="XX" attributes="64759"/>
      <index>
        <pos row="11" column="29"/>
        <pos row="12" column="29"/>
        <pos row="13" column="29"/>
        <pos row="14" column="29"/>
        <pos row="15" column="29"/>
        <pos row="16" column="29"/>
        <pos row="17" column="29"/>
        <pos row="18" column="29"/>
        <pos row="19" column="29"/>
        <pos row="20" column="29"/>
      </index>
    </field>

    <field name="FRM-FEC-FRPR" special="FEC">
      <type name="date" size="8" integers="8"/>
      <fms name="FRM_FEC_FRPR" modifier="FLD" picture="99999999" attributes="64759"/>
      <index>
        <pos row="11" column="40"/>
        <pos row="12" column="40"/>
        <pos row="13" column="40"/>
        <pos row="14" column="40"/>
        <pos row="15" column="40"/>
        <pos row="16" column="40"/>
        <pos row="17" column="40"/>
        <pos row="18" column="40"/>
        <pos row="19" column="40"/>
        <pos row="20" column="40"/>
      </index>
    </field>

  </array>

  <primary>
    <field name="DBC-VRF-ICLI"/>
    <field name="DBC-IDC-ICLI"/>
    <field name="RPR-COD-TFRM"/>
    <field name="RPR-IND-ESTA"/>
  </primary>

  <foreign entity="{{{TODO_foreign_entity}}}">
    <field name="FRM-IND-HMAS"/>
  </foreign>

  <foreign entity="{{{TODO_foreign_entity}}}">
    <field name="FRM-CAI-IFOR"/>
  </foreign>

  <foreign entity="{{{TODO_foreign_entity}}}">
    <field name="FRM-IIC-IFOR"/>
  </foreign>

  <text caption="IdC Cliente" row="3" column="3" />
  <text caption="Nombre/R.Social" row="4" column="3" />
  <text caption="Doc.Recibidos" row="5" column="3" />
  <text caption="Estado Formulario" row="6" column="3" />
  <text caption="Folio          Estado  Doc.Recib.  Fecha Recepcion" row="9" column="3" />
  <text caption="---------------------------------------------------------------------------" row="10" column="3" />

</form>
