<?xml version = "1.0" encoding = "ISO-8859-1" ?>

<form xmlns              = "http://cl/bee/genfrmjava/formdef/schema"
      xmlns:xsi          = "http://www.w3.org/2001/XMLSchema-instance"
      xsi:schemaLocation = "http://cl/bee/genfrmjava/formdef/schema formdef.xsd"
      entity             = "DAP_CCC"
      name               = "CCC"
      posx               = "1"
      posy               = "23"
      width              = "80">

  <field name="DBC-GLS-NOMC" special="GLS">
    <type name="string" size="56"/>
    <fms name="DBC_AKY_GLS_NOMC" modifier="AKY" row="3" column="21" picture="XXXXXXXXXXXXXXXXXXXXXXXXXXXXXXXXXXXXXXXXXXXXXXXXXXXXXXXX" attributes="65013"/>
  </field>

  <field name="DBC-VRF-ICLI" special="VRF">
    <type name="string" size="10"/>
    <fms name="DBC_AKY_VRF_ICLI" modifier="AKY" row="4" column="21" picture="XXXXXXXX-X" attributes="65013"/>
  </field>

  <field name="DBC-IDC-ICLI" special="IDC">
    <type name="string" size="5"/>
    <fms name="DBC_AKY_IDC_ICLI" modifier="AKY" row="4" column="38" picture="X-XXX" attributes="65013"/>
  </field>

  <array size="6">

    <field name="FRM-VAL-TOTA">
      <type name="double" size="20" integers="12" decimals="4" sign="no" />
      <fms name="FRM_VAL_TOTA" modifier="FLD" picture="999.999.999.999,9999" attributes="64759"/>
      <index>
        <pos row="6" column="21"/>
        <pos row="6" column="51"/>
        <pos row="7" column="21"/>
        <pos row="7" column="51"/>
        <pos row="8" column="21"/>
        <pos row="8" column="51"/>
      </index>
    </field>

    <field name="FRM-GLS-TOTA" special="GLS">
      <type name="string" size="5"/>
      <fms name="FRM_GLS_TOTA" modifier="FLD" picture="XXXXX" attributes="64759"/>
      <index>
        <pos row="6" column="45"/>
        <pos row="6" column="75"/>
        <pos row="7" column="45"/>
        <pos row="7" column="75"/>
        <pos row="8" column="45"/>
        <pos row="8" column="75"/>
      </index>
    </field>

  </array>

  <array size="11">

    <field name="FRM-CAI-IOPD">
      <type name="string" size="4"/>
      <fms name="FRM_CAI_IOPD" modifier="FLD" picture="XXXX" attributes="64759"/>
      <index>
        <pos row="11" column="2"/>
        <pos row="12" column="2"/>
        <pos row="13" column="2"/>
        <pos row="14" column="2"/>
        <pos row="15" column="2"/>
        <pos row="16" column="2"/>
        <pos row="17" column="2"/>
        <pos row="18" column="2"/>
        <pos row="19" column="2"/>
        <pos row="20" column="2"/>
        <pos row="21" column="2"/>
      </index>
    </field>

    <field name="FRM-IIC-IOPD">
      <type name="integer" size="8" integers="8"/>
      <fms name="FRM_IIC_IOPD" modifier="FLD" picture="99999999" attributes="64759"/>
      <index>
        <pos row="11" column="7"/>
        <pos row="12" column="7"/>
        <pos row="13" column="7"/>
        <pos row="14" column="7"/>
        <pos row="15" column="7"/>
        <pos row="16" column="7"/>
        <pos row="17" column="7"/>
        <pos row="18" column="7"/>
        <pos row="19" column="7"/>
        <pos row="20" column="7"/>
        <pos row="21" column="7"/>
      </index>
    </field>

    <field name="FRM-IND-VENC">
      <type name="char" size="1"/>
      <fms name="FRM_IND_VENC" modifier="FLD" picture="X" attributes="64759"/>
      <index>
        <pos row="11" column="16"/>
        <pos row="12" column="16"/>
        <pos row="13" column="16"/>
        <pos row="14" column="16"/>
        <pos row="15" column="16"/>
        <pos row="16" column="16"/>
        <pos row="17" column="16"/>
        <pos row="18" column="16"/>
        <pos row="19" column="16"/>
        <pos row="20" column="16"/>
        <pos row="21" column="16"/>
      </index>
    </field>

    <field name="FRM-GLS-COPD" special="GLS">
      <type name="string" size="21"/>
      <fms name="FRM_GLS_COPD" modifier="FLD" picture="XXXXXXXXXXXXXXXXXXXXX" attributes="64759"/>
      <index>
        <pos row="11" column="18"/>
        <pos row="12" column="18"/>
        <pos row="13" column="18"/>
        <pos row="14" column="18"/>
        <pos row="15" column="18"/>
        <pos row="16" column="18"/>
        <pos row="17" column="18"/>
        <pos row="18" column="18"/>
        <pos row="19" column="18"/>
        <pos row="20" column="18"/>
        <pos row="21" column="18"/>
      </index>
    </field>

    <field name="FRM-DMA-FREA" special="FEC">
      <type name="date" size="6" integers="6"/>
      <fms name="FRM_DMA_FREA" modifier="FLD" picture="999999" attributes="64759"/>
      <index>
        <pos row="11" column="40"/>
        <pos row="12" column="40"/>
        <pos row="13" column="40"/>
        <pos row="14" column="40"/>
        <pos row="15" column="40"/>
        <pos row="16" column="40"/>
        <pos row="17" column="40"/>
        <pos row="18" column="40"/>
        <pos row="19" column="40"/>
        <pos row="20" column="40"/>
        <pos row="21" column="40"/>
      </index>
    </field>

    <field name="FRM-DMA-FPVC" special="FEC">
      <type name="date" size="6" integers="6"/>
      <fms name="FRM_DMA_FPVC" modifier="FLD" picture="999999" attributes="64759"/>
      <index>
        <pos row="11" column="47"/>
        <pos row="12" column="47"/>
        <pos row="13" column="47"/>
        <pos row="14" column="47"/>
        <pos row="15" column="47"/>
        <pos row="16" column="47"/>
        <pos row="17" column="47"/>
        <pos row="18" column="47"/>
        <pos row="19" column="47"/>
        <pos row="20" column="47"/>
        <pos row="21" column="47"/>
      </index>
    </field>

    <field name="FRM-VAL-CAPT">
      <type name="double" size="19" integers="11" decimals="4" sign="no" />
      <fms name="FRM_VAL_CAPT" modifier="FLD" picture="99.999.999.999,9999" attributes="64759"/>
      <index>
        <pos row="11" column="54"/>
        <pos row="12" column="54"/>
        <pos row="13" column="54"/>
        <pos row="14" column="54"/>
        <pos row="15" column="54"/>
        <pos row="16" column="54"/>
        <pos row="17" column="54"/>
        <pos row="18" column="54"/>
        <pos row="19" column="54"/>
        <pos row="20" column="54"/>
        <pos row="21" column="54"/>
      </index>
    </field>

    <field name="FRM-GLS-VCAM" special="GLS">
      <type name="string" size="5"/>
      <fms name="FRM_GLS_VCAM" modifier="FLD" picture="XXXXX" attributes="64759"/>
      <index>
        <pos row="11" column="74"/>
        <pos row="12" column="74"/>
        <pos row="13" column="74"/>
        <pos row="14" column="74"/>
        <pos row="15" column="74"/>
        <pos row="16" column="74"/>
        <pos row="17" column="74"/>
        <pos row="18" column="74"/>
        <pos row="19" column="74"/>
        <pos row="20" column="74"/>
        <pos row="21" column="74"/>
      </index>
    </field>

  </array>

  <foreign entity="{{{TODO_foreign_entity}}}">
    <field name="DBC-GLS-NOMC"/>
  </foreign>

  <foreign entity="{{{TODO_foreign_entity}}}">
    <field name="DBC-VRF-ICLI"/>
  </foreign>

  <foreign entity="{{{TODO_foreign_entity}}}">
    <field name="DBC-IDC-ICLI"/>
  </foreign>

  <text caption="01. Cliente" row="3" column="2" />
  <text caption="02. IdC Cliente" row="4" column="2" />
  <text caption="Totales x Moneda" row="6" column="2" />
  <text caption="Nro Operac.   V Clase                 F.Cap  F.Ven          Monto Capt. Moneda" row="9" column="2" />
  <text caption="------------------------------------------------------------------------------" row="10" column="2" />

</form>
